{
  "id": "LISAN-GOV-230",
  "revision": 1,
  "text_en": "Separate the immutable policy kernel from shorter role-specific, stage-specific instruction bundles; a long register must not be injected wholesale into each model context as its only enforcement mechanism.",
  "text_ar": "يجب فصل النواة الثابتة للسياسات عن حزم تعليمات مختصرة بحسب الدور والمرحلة، ولا يجوز حقن السجل الطويل بكامله في سياق كل نموذج واعتبار ذلك آلية الإنفاذ الوحيدة.",
  "kind": "POLICY",
  "kind_ar": "سياسة",
  "force": "MUST",
  "category": "Artificial intelligence and agents",
  "rule_status": "PROPOSED",
  "authority_level": "REFERENCE_DRAFT",
  "source_reference": "UNIFIED §13.1 (531–541); AICAF §13.1 (541–549)",
  "source_quote": null,
  "source_digest": null,
  "source_status": "SOURCE_DERIVED_PROPOSAL",
  "scope_context": "LISAN research-agent context assembly",
  "applicable_modes": [
    "NEW_CORPUS_STUDY",
    "CUMULATIVE_EXTENSION"
  ],
  "applies_to": [
    "AI_RUNTIME"
  ],
  "trigger_event": "CONTEXT_ASSEMBLY",
  "trigger_predicate": "Apply only if event, phase, actor authorization and scoped rule predicate all match; require policy admission.",
  "expected_behavior": "Separate the immutable policy kernel from shorter role-specific, stage-specific instruction bundles; a long register must not be injected wholesale into each model context as its only enforcement mechanism.",
  "enforcement_target": "HOST_CONTEXT",
  "enforcement_status": "NOT_VERIFIED",
  "verification_mode": "HYBRID",
  "failure_action": "FLAG_FOR_REVIEW",
  "admission_status": "NEW_CANDIDATE_NOT_ENFORCED",
  "risk_tier": "HIGH",
  "reviewer_id": null,
  "approved_by": null,
  "effective_from": null,
  "supersedes": [],
  "evidence_refs": [],
  "test_refs": [],
  "impact_metric_id": "M08",
  "impact_measurement_status": "NOT_MEASURED",
  "impact_baseline": null,
  "impact_treatment": null,
  "exceptions": [],
  "rationale": "Illustrative configuration; not an approved project policy or deployed enforcement rule."
}